Name,Gender,Star,Summary,Director,Realase Date,Reward
Spotlight,Biography,8.1,"The true story of how the Boston Globe uncovered the massive scandal of child molestation and cover-up within the local Catholic Archdiocese, shaking the entire Catholic Church to its core.",Tom McCarthy,2015,124 wins & 143 nominations total
Koe no katachi,Animation,8.2,"A young man is ostracized by his classmates after he bullies a deaf girl to the point where she moves away. Years later, he sets off on a path for redemption.",Naoko Yamada,2016,4 wins & 8 nominations
Life of Brian,Comedy,8.1,"Born on the original Christmas in the stable next door to Jesus Christ, Brian of Nazareth spends his life being mistaken for a messiah.",Terry Jones,1979,See the Top 250 movies as rated by IMDb users
Rebecca,Drama,8.1,A self-conscious woman juggles adjusting to her new role as an aristocrat's wife and avoiding being intimidated by his first wife's spectral presence.,Alfred Hitchcock,1940,7 wins & 10 nominations total
"Monsters, Inc.",Animation,8.1,"In order to power the city, monsters have to scare children so that they scream. However, the children are toxic to the monsters, and after a child gets through, two monsters realize things may not be what they think.",Pete Docter,2001,15 wins & 38 nominations total
Hotel Rwanda,Biography,8.1,"Paul Rusesabagina, a hotel manager, houses over a thousand Tutsi refugees during their struggle against the Hutu militia in Rwanda, Africa.",Terry George,2004,16 wins & 49 nominations total
Fa yeung nin wah,Drama,8.1,"Two neighbors form a strong bond after both suspect extramarital activities of their spouses. However, they agree to keep their bond platonic so as not to commit similar wrongs.",Kar-Wai Wong,2000,46 wins & 51 nominations total
Rush,Action,8.1,The merciless 1970s rivalry between Formula One rivals James Hunt and Niki Lauda.,Ron Howard,2013,6 wins & 65 nominations total
Into the Wild,Adventure,8.1,"After graduating from Emory University, top student and athlete Christopher McCandless abandons his possessions, gives his entire $24,000 savings account to charity and hitchhikes to Alaska to live in the wilderness. Along the way, Christopher encounters a series of characters that shape his life.",Sean Penn,2007,23 wins & 106 nominations total
Strasti po Andreyu,Biography,8.1,"The life, times and afflictions of the fifteenth-century Russian iconographer St. Andrei Rublev.",Andrei Tarkovsky,1966,5 wins & 2 nominations
Amores perros,Drama,8.1,"A horrific car accident connects three stories, each involving characters dealing with loss, regret, and life's harsh realities, all in the name of love.",Alejandro G. Iñárritu,2000,55 wins & 25 nominations total
Rocky,Drama,8.1,A small-time boxer gets a supremely rare chance to fight a heavyweight champion in a bout in which he strives to go the distance for his self-respect.,John G. Avildsen,1976,20 wins & 21 nominations total
It Happened One Night,Comedy,8.1,"A renegade reporter and a crazy young heiress meet on a bus heading for New York, and end up stuck with each other when the bus leaves them behind at one of the stops.",Frank Capra,1934,11 wins & 2 nominations total
Kaze no tani no Naushika,Animation,8.1,Warrior and pacifist Princess Nausicaä desperately struggles to prevent two warring nations from destroying themselves and their dying planet.,Hayao Miyazaki,1984,4 wins & 2 nominations
"Shin seiki Evangelion Gekijô-ban: Air/Magokoro wo, kimi ni",Animation,8.1,Concurrent theatrical ending of the TV series Shin seiki evangerion (1995).,Hideaki Anno,1997,2 wins
La battaglia di Algeri,Drama,8.1,"In the 1950s, fear and violence escalate as the people of Algiers fight for independence from the French government.",Gillo Pontecorvo,1966,9 wins & 9 nominations total
Before Sunset,Drama,8.1,"Nine years after Jesse and Celine first met, they encounter each other again on the French leg of Jesse's book tour.",Richard Linklater,2004,9 wins & 32 nominations total
Fanny och Alexander,Drama,8.1,"Two young Swedish children experience the many comedies and tragedies of their family, the Ekdahls.",Ingmar Bergman,1982,25 wins & 12 nominations total
Trois couleurs: Rouge,Drama,8.1,A model discovers a retired judge is keen on invading people's privacy.,Krzysztof Kieslowski,1994,19 wins & 29 nominations total
Kimetsu no Yaiba: Mugen Ressha-Hen,Animation,8.3,"After his family was brutally murdered and his sister turned into a demon, Tanjiro Kamado's journey as a demon slayer began. Tanjiro and his comrades embark on a new mission aboard the Mugen Train, on track to despair.",Haruo Sotozaki,2020,3 wins & 3 nominations
"Paris, Texas",Drama,8.1,"Travis Henderson, an aimless drifter who has been missing for four years, wanders out of the desert and must reconnect with society, himself, his life, and his family.",Wim Wenders,1984,18 wins & 12 nominations total
The Princess Bride,Adventure,8.1,"While home sick in bed, a young boy's grandfather reads him the story of a farmboy-turned-pirate who encounters numerous obstacles, enemies and allies in his quest to be reunited with his true love.",Rob Reiner,1987,7 wins & 10 nominations total
Ratsasan,Action,8.5,A sub-inspector sets out in pursuit of a mysterious serial killer who targets teen school girls and murders them brutally.,Ram Kumar,2018,3 wins & 6 nominations
Du rififi chez les hommes,Crime,8.1,"Four men plan a technically perfect crime, but the human element intervenes...",Jules Dassin,1955,6 wins & 1 nomination
Le notti di Cabiria,Drama,8.1,A waifish prostitute wanders the streets of Rome looking for true love but finds only heartbreak.,Federico Fellini,1957,17 wins & 8 nominations total
Sunrise: A Song of Two Humans,Drama,8.1,"A sophisticated urban woman seduces a farmer in the hopes that he will murder his neglected wife and join her in the city, but he soon finds himself rekindling his romance with the latter when she discovers their scheme.",F.W. Murnau,1927,6 wins & 2 nominations total
